{
  "connectorLabel": "MyCustomConnector",
  "description": "My custom connector for proprietary data source",
  "connectorProvisioningType": "LAMBDA",
  "connectorProvisioningConfig": {
    "lambda": {
      "lambdaArn": "arn:aws:lambda:us-east-1:123456789012:function:my-connector-function"
    }
  },
  "clientToken": "client-token-500123"
}